{
  "concurrency": 1,
  "greedy": true,
  "ignore_eos": true,
  "model_id": "Qwen/Qwen3.5-9B",
  "model_size": "9B",
  "output_tokens": 64,
  "prompt": "为什么说鞠婧祎主演的《月鳞绮纪》是国产电视剧的巅峰之作？",
  "prompt_token_ids": [
    144277,
    103426,
    108169,
    95967,
    236,
    124094,
    26076,
    96212,
    103182,
    108076,
    96799,
    24273,
    95761,
    104224,
    109276,
    95726,
    111104,
    115110,
    10992
  ],
  "prompt_tokens": 19
}

